{
  "$id": "icon-manifest.schema.json",
  "$schema": "https://json-schema.org/draft/2020-12/schema",
  "additionalProperties": false,
  "changelog": [
    {
      "change": "Initial shape: the generated icon set, its source and its licence.",
      "version": "2026-08-29",
      "why": "The surface had two inline SVGs and no system, so a mark was whatever fitted."
    }
  ],
  "description": "What was generated, from where, under which licence.",
  "properties": {
    "icons": {
      "items": {
        "pattern": "^[a-z0-9]+(?:-[a-z0-9]+)*$",
        "type": "string"
      },
      "title": "Icons",
      "type": "array"
    },
    "licence": {
      "title": "Licence",
      "type": "string"
    },
    "source": {
      "title": "Source",
      "type": "string"
    },
    "version": {
      "default": "2026-08-29",
      "pattern": "^\\d{4}-\\d{2}-\\d{2}(?:T\\d{2}:\\d{2}(?::\\d{2})?)?$",
      "title": "Version",
      "type": "string"
    }
  },
  "required": [
    "source",
    "licence",
    "icons"
  ],
  "title": "IconManifest",
  "type": "object",
  "version": "2026-08-29"
}
