{
  "icons": [
    "archive",
    "band-high",
    "band-low",
    "band-medium",
    "console",
    "external",
    "read-aloud",
    "search",
    "theme-dark",
    "theme-light",
    "topic-ai",
    "topic-business-economy",
    "topic-energy",
    "topic-india",
    "topic-world"
  ],
  "licence": "ISC",
  "source": "lucide",
  "version": "2026-08-29"
}
